run_id,attack,model,dataset,input_index,num_sentences,joined_reference,joined_prediction,reconstruction_time_sec,rouge1_fm,rouge2_fm,rougeL_fm,exact_match,token_acc,padded_token_acc,pred_len,ref_len
ad07dc8ddbc6,hybrid_ce,gpt2,sst2,28,4,"writer/director joe carnahan's grimy crime drama is a manual of precinct cliches, but it moves fast enough to cover its clunky dialogue and lapses in logic.  this is an egotistical endeavor from the daughter of horror director dario argento ( a producer here ), but her raw performance and utter fearlessness make it strangely magnetic.  the movie does a good job of laying out some of the major issues that we encounter as we journey through life.  a hamfisted romantic comedy that makes our girl the hapless facilitator of an extended cheap shot across the mason-dixon line. ","writer/director joe carnahan's grimy crime drama is a manual of precinct cliches, but it moves fast enough to cover its clunky dialogue and lapses in logic.  this is an egotistical endeavor from the daughter of horror director dario argento ( a producer here ), but her raw performance and utter fearlessness make it strangely magnetic.  the movie does a good job of laying out some of the major issues that we encounter as we journey through life.  a hamfisted romantic comedy that makes our girl the hapless facilitator of an extended cheap shot across the mason-dixon line. ",11.062112808227539,1.0,1.0,1.0,1,1.0,1.0,129,129
ad07dc8ddbc6,hybrid_ce,gpt2,sst2,29,4,"sustains its dreamlike glide through a succession of cheesy coincidences and voluptuous cheap effects, not the least of which is rebecca romijn-stamos.  it inspires a continuing and deeply satisfying awareness of the best movies as monumental ` picture shows.' nothing is sacred in this gut-buster.  it's hampered by a lifetime-channel kind of plot and a lead actress who is out of her depth. ","sustains its dreamlike glide through a succession of cheesy coincidences and voluptuous cheap effects, not the least of which is rebecca romijn-stamos.  it inspires a continuing and deeply satisfying awareness of the best movies as monumental ` picture shows.' nothing is sacred in this gut-buster.  it's hampered by a lifetime-channel kind of plot and a lead actress who is out of her depth. ",10.83117389678955,1.0,1.0,1.0,1,1.0,1.0,88,88
ad07dc8ddbc6,hybrid_ce,gpt2,sst2,30,4,"and the lesson, in the end, is nothing new.  aside from minor tinkering, this is the same movie you probably loved in 1994, except that it looks even better.  brilliantly explores the conflict between following one's heart and following the demands of tradition.  a rigorously structured and exquisitely filmed drama about a father and son connection that is a brief shooting star of love. ","and the lesson, in the end, is nothing new.  aside from minor tinkering, this is the same movie you probably loved in 1994, except that it looks even better.  brilliantly explores the conflict between following one's heart and following the demands of tradition.  a rigorously structured and exquisitely filmed drama about a father and son connection that is a brief shooting star of love. ",10.654403448104858,1.0,1.0,1.0,1,1.0,1.0,81,81
ad07dc8ddbc6,hybrid_ce,gpt2,sst2,31,4,"it can not be enjoyed, even on the level that one enjoys a bad slasher flick, primarily because it is dull.  a taut psychological thriller that doesn't waste a moment of its two-hour running time.  a study in shades of gray, offering itself up in subtle plot maneuvers...  the far future may be awesome to consider, but from period detail to matters of the heart, this film is most transporting when it stays put in the past. ","it can not be enjoyed, even on the level that one enjoys a bad slasher flick, primarily because it is dull.  a taut psychological thriller that doesn't waste a moment of its two-hour running time.  a study in shades of gray, offering itself up in subtle plot maneuvers...  the far future may be awesome to consider, but from period detail to matters of the heart, this film is most transporting when it stays put in the past. ",10.732310056686401,1.0,1.0,1.0,1,1.0,1.0,95,95
ad07dc8ddbc6,hybrid_ce,gpt2,sst2,32,4,"if the first men in black was money, the second is small change.  charles'entertaining film chronicles seinfeld's return to stand-up comedy after the wrap of his legendary sitcom, alongside wannabe comic adams'attempts to get his shot at the big time.  if the movie succeeds in instilling a wary sense of ` there but for the grace of god,'it is far too self-conscious to draw you deeply into its world.  ... designed to provide a mix of smiles and tears, `` crossroads '' instead provokes a handful of unintentional howlers and numerous yawns. ","if the first men in black was money, the second is small change.  charles'entertaining film chronicles seinfeld's return to stand-up comedy after the wrap of his legendary sitcom, alongside wannabe comic adams'attempts to get his shot at the big time.  if the movie succeeds in instilling a wary sense of ` there but for the grace of god,'it is far too self-conscious to draw you deeply into its world.  ... designed to provide a mix of smiles and tears, `` crossroads '' instead provokes a handful of unintentional howlers and numerous yawns. ",11.185256481170654,1.0,1.0,1.0,1,1.0,1.0,129,129
ad07dc8ddbc6,hybrid_ce,gpt2,sst2,33,4,"whether you like rap music or loathe it, you can't deny either the tragic loss of two young men in the prime of their talent or the power of this movie.  with tightly organized efficiency, numerous flashbacks and a constant edge of tension, miller's film is one of 2002's involvingly adult surprises.  the minor figures surrounding ( bobby )... form a gritty urban mosaic.  vera's three actors -- mollà, gil and bardem -- excel in insightful, empathetic performances. ","whether you like rap music or loathe it, you can't deny either the tragic loss of two young men in the prime of their talent or the power of this movie.  with tightly organized efficiency, numerous flashbacks and a constant edge of tension, miller's film is one of 2002's involvingly adult surprises.  the minor figures surrounding ( bobby )... form a gritty urban mosaic.  vera's three actors -- mollà, gil and bardem -- excel in insightful, empathetic performances. ",11.062196731567383,1.0,1.0,1.0,1,1.0,1.0,108,108
ad07dc8ddbc6,hybrid_ce,gpt2,sst2,34,4,"it's great escapist fun that recreates a place and time that will never happen again.  the son's room is a triumph of gentility that earns its moments of pathos.  but the power of these ( subjects ) is obscured by the majority of the film that shows a stationary camera on a subject that could be mistaken for giving a public oration, rather than contributing to a film's narrative.  it's one pussy-ass world when even killer-thrillers revolve around group therapy sessions. ","it's great escapist fun that recreates a place and time that will never happen again.  the son's room is a triumph of gentility that earns its moments of pathos.  but the power of these ( subjects ) is obscured by the majority of the film that shows a stationary camera on a subject that could be mistaken for giving a public oration, rather than contributing to a film's narrative.  it's one pussy-ass world when even killer-thrillers revolve around group therapy sessions. ",11.051143884658813,1.0,1.0,1.0,1,1.0,1.0,107,107
ad07dc8ddbc6,hybrid_ce,gpt2,sst2,35,4,"stealing harvard aspires to comedic grand larceny but stands convicted of nothing more than petty theft of your time.  light years / several warp speeds / levels and levels of dilithium crystals better than the pitiful insurrection.  the director knows how to apply textural gloss, but his portrait of sex-as-war is strictly sitcom.  so, too, is this comedy about mild culture clashing in today's new delhi. ","stealing harvard aspires to comedic grand larceny but stands convicted of nothing more than petty theft of your time.  light years / several warp speeds / levels and levels of dilithium crystals better than the pitiful insurrection.  the director knows how to apply textural gloss, but his portrait of sex-as-war is strictly sitcom.  so, too, is this comedy about mild culture clashing in today's new delhi. ",10.647071123123169,1.0,1.0,1.0,1,1.0,1.0,93,93
ad07dc8ddbc6,hybrid_ce,gpt2,sst2,36,4,"deliriously funny, fast and loose, accessible to the uninitiated, and full of surprises  filmmakers who can deftly change moods are treasures and even marvels.  although laced with humor and a few fanciful touches, the film is a refreshingly serious look at young women.  so devoid of any kind of intelligible story that it makes films like xxx and collateral damage seem like thoughtful treatises ","deliriously funny, fast and loose, accessible to the uninitiated, and full of surprises  filmmakers who can deftly change moods are treasures and even marvels.  although laced with humor and a few fanciful touches, the film is a refreshingly serious look at young women.  so devoid of any kind of intelligible story that it makes films like xxx and collateral damage seem like thoughtful treatises ",10.636020421981812,1.0,1.0,1.0,1,1.0,1.0,86,86
ad07dc8ddbc6,hybrid_ce,gpt2,sst2,37,4,"the film is beautifully mounted, but, more to the point, the issues are subtly presented, managing to walk a fine line with regard to the question of joan's madness.  makes for a pretty unpleasant viewing experience.  late marriage's stiffness is unlikely to demonstrate the emotional clout to sweep u.s. viewers off their feet.  no sophomore slump for director sam mendes, who segues from oscar winner to oscar-winning potential with a smooth sleight of hand. ","the film is beautifully mounted, but, more to the point, the issues are subtly presented, managing to walk a fine line with regard to the question of joan's madness.  makes for a pretty unpleasant viewing experience.  late marriage's stiffness is unlikely to demonstrate the emotional clout to sweep u.s. viewers off their feet.  no sophomore slump for director sam mendes, who segues from oscar winner to oscar-winning potential with a smooth sleight of hand. ",11.019118309020996,1.0,1.0,1.0,1,1.0,1.0,101,101
ad07dc8ddbc6,hybrid_ce,gpt2,sst2,38,4,"it's too self-important and plodding to be funny, and too clipped and abbreviated to be an epic.  collateral damage finally delivers the goods for schwarzenegger fans.  ... mafia, rap stars and hood rats butt their ugly heads in a regurgitation of cinematic violence that gives brutal birth to an unlikely, but likable, hero.' detox is ultimately a pointless endeavor. ","it's too self-important and plodding to be funny, and too clipped and abbreviated to be an epic.  collateral damage finally delivers the goods for schwarzenegger fans.  ... mafia, rap stars and hood rats butt their ugly heads in a regurgitation of cinematic violence that gives brutal birth to an unlikely, but likable, hero.' detox is ultimately a pointless endeavor. ",10.838931798934937,1.0,1.0,1.0,1,1.0,1.0,82,82
ad07dc8ddbc6,hybrid_ce,gpt2,sst2,39,4,"nicks, seemingly uncertain what's going to make people laugh, runs the gamut from stale parody to raunchy sex gags to formula romantic comedy.  the band's courage in the face of official repression is inspiring, especially for aging hippies ( this one included ).  the mesmerizing performances of the leads keep the film grounded and keep the audience riveted.  all that's missing is the spontaneity, originality and delight. ","nicks, seemingly uncertain what's going to make people laugh, runs the gamut from stale parody to raunchy sex gags to formula romantic comedy.  the band's courage in the face of official repression is inspiring, especially for aging hippies ( this one included ).  the mesmerizing performances of the leads keep the film grounded and keep the audience riveted.  all that's missing is the spontaneity, originality and delight. ",11.187015056610107,1.0,1.0,1.0,1,1.0,1.0,92,92
ad07dc8ddbc6,hybrid_ce,gpt2,sst2,40,4,"portentous and pretentious, the weight of water is appropriately titled, given the heavy-handedness of it drama.  outer-space buffs might love this film, but others will find its pleasures intermittent.  offers very little genuine romance and even fewer laughs... a sad sitcom of a movie, largely devoid of charm.  every nanosecond of the the new guy reminds you that you could be doing something else far more pleasurable. ","portentous and pretentious, the weight of water is appropriately titled, given the heavy-handedness of it drama.  outer-space buffs might love this film, but others will find its pleasures intermittent.  offers very little genuine romance and even fewer laughs... a sad sitcom of a movie, largely devoid of charm.  every nanosecond of the the new guy reminds you that you could be doing something else far more pleasurable. ",10.68261432647705,1.0,1.0,1.0,1,1.0,1.0,91,91
ad07dc8ddbc6,hybrid_ce,gpt2,sst2,41,4,"suffocated by its fussy script and uptight characters, this musty adaptation is all the more annoying since it's been packaged and sold back to us by hollywood.  its well of thorn and vinegar ( and simple humanity ) has long been plundered by similar works featuring the insight and punch this picture so conspicuously lacks.  i had to look away - this was god awful.  drops you into a dizzying, volatile, pressure-cooker of a situation that quickly snowballs out of control, while focusing on the what much more than the why. ","suffocated by its fussy script and uptight characters, this musty adaptation is all the more annoying since it's been packaged and sold back to us by hollywood.  its well of thorn and vinegar ( and simple humanity ) has long been plundered by similar works featuring the insight and punch this picture so conspicuously lacks.  i had to look away - this was god awful.  drops you into a dizzying, volatile, pressure-cooker of a situation that quickly snowballs out of control, while focusing on the what much more than the why. ",10.932156562805176,1.0,1.0,1.0,1,1.0,1.0,117,117
ad07dc8ddbc6,hybrid_ce,gpt2,sst2,42,4,"it all adds up to good fun.  at its best, queen is campy fun like the vincent price horror classics of the '60s.  to say this was done better in wilder's some like it hot is like saying the sun rises in the east.  when the film ended, i felt tired and drained and wanted to lie on my own deathbed for a while. ","it all adds up to good fun.  at its best, queen is campy fun like the vincent price horror classics of the '60s.  to say this was done better in wilder's some like it hot is like saying the sun rises in the east.  when the film ended, i felt tired and drained and wanted to lie on my own deathbed for a while. ",10.720319986343384,1.0,1.0,1.0,1,1.0,1.0,81,81
ad07dc8ddbc6,hybrid_ce,gpt2,sst2,43,4,"green might want to hang onto that ski mask, as robbery may be the only way to pay for his next project.  a film about a young man finding god that is accessible and touching to the marrow.  this flick is about as cool and crowd-pleasing as a documentary can get.  although huppert's intensity and focus has a raw exhilaration about it, the piano teacher is anything but fun. ","green might want to hang onto that ski mask, as robbery may be the only way to pay for his next project.  a film about a young man finding god that is accessible and touching to the marrow.  this flick is about as cool and crowd-pleasing as a documentary can get.  although huppert's intensity and focus has a raw exhilaration about it, the piano teacher is anything but fun. ",10.833405256271362,1.0,1.0,1.0,1,1.0,1.0,86,86
ad07dc8ddbc6,hybrid_ce,gpt2,sst2,44,4,"despite its title, punch-drunk love is never heavy-handed.  movie fans, get ready to take off... the other direction.  i 'll bet the video game is a lot more fun than the film.  a beguiling splash of pastel colors and prankish comedy from disney. ","despite its title, punch-drunk love is never heavy-handed.  movie fans, get ready to take off... the other direction.  i 'll bet the video game is a lot more fun than the film.  a beguiling splash of pastel colors and prankish comedy from disney. ",10.51900863647461,1.0,1.0,1.0,1,1.0,1.0,65,65
ad07dc8ddbc6,hybrid_ce,gpt2,sst2,45,4,"a romantic comedy enriched by a sharp eye for manners and mores.  made with no discernible craft and monstrously sanctimonious in dealing with childhood loss.  the humor is forced and heavy-handed, and occasionally simply unpleasant.  not since tom cruise in risky business has an actor made such a strong impression in his underwear. ","a romantic comedy enriched by a sharp eye for manners and mores.  made with no discernible craft and monstrously sanctimonious in dealing with childhood loss.  the humor is forced and heavy-handed, and occasionally simply unpleasant.  not since tom cruise in risky business has an actor made such a strong impression in his underwear. ",10.666407823562622,1.0,1.0,1.0,1,1.0,1.0,69,69
ad07dc8ddbc6,hybrid_ce,gpt2,sst2,46,4,"while the ideas about techno-saturation are far from novel, they're presented with a wry dark humor.  thanks to haynes'absolute control of the film's mood, and buoyed by three terrific performances, far from heaven actually pulls off this stylistic juggling act.  may be far from the best of the series, but it's assured, wonderfully respectful of its past and thrilling enough to make it abundantly clear that this movie phenomenon has once again reinvented itself for a new generation.  the film's welcome breeziness and some unbelievably hilarious moments -- most portraying the idiocy of the film industry -- make it mostly worth the trip. ","while the ideas about techno-saturation are far from novel, they're presented with a wry dark humor.  thanks to haynes'absolute control of the film's mood, and buoyed by three terrific performances, far from heaven actually pulls off this stylistic juggling act.  may be far from the best of the series, but it's assured, wonderfully respectful of its past and thrilling enough to make it abundantly clear that this movie phenomenon has once again reinvented itself for a new generation.  the film's welcome breeziness and some unbelievably hilarious moments -- most portraying the idiocy of the film industry -- make it mostly worth the trip. ",16.645894765853882,1.0,1.0,1.0,1,1.0,1.0,133,133
ad07dc8ddbc6,hybrid_ce,gpt2,sst2,47,4,"nelson's brutally unsentimental approach... sucks the humanity from the film, leaving behind an horrific but weirdly unemotional spectacle.  a coda in every sense, the pinochet case splits time between a minute-by-minute account of the british court's extradition chess game and the regime's talking-head survivors.  ` easily my choice for one of the year's best films.' a spellbinding african film about the modern condition of rootlessness, a state experienced by millions around the globe. ","nelson's brutally unsentimental approach... sucks the humanity from the film, leaving behind an horrific but weirdly unemotional spectacle.  a coda in every sense, the pinochet case splits time between a minute-by-minute account of the british court's extradition chess game and the regime's talking-head survivors.  ` easily my choice for one of the year's best films.' a spellbinding african film about the modern condition of rootlessness, a state experienced by millions around the globe. ",16.20799493789673,1.0,1.0,1.0,1,1.0,1.0,107,107
ad07dc8ddbc6,hybrid_ce,gpt2,sst2,48,4,"or doing last year's taxes with your ex-wife.  impostor has a handful of thrilling moments and a couple of good performances, but the movie doesn't quite fly.  a nightmare date with a half-formed wit done a great disservice by a lack of critical distance and a sad trust in liberal arts college bumper sticker platitudes.  the chateau cleverly probes the cross-cultural differences between gauls and yanks. ","or doing last year's taxes with your ex-wife.  impostor has a handful of thrilling moments and a couple of good performances, but the movie doesn't quite fly.  a nightmare date with a half-formed wit done a great disservice by a lack of critical distance and a sad trust in liberal arts college bumper sticker platitudes.  the chateau cleverly probes the cross-cultural differences between gauls and yanks. ",16.060565948486328,1.0,1.0,1.0,1,1.0,1.0,93,93
ad07dc8ddbc6,hybrid_ce,gpt2,sst2,49,4,"his last movie was poetically romantic and full of indelible images, but his latest has nothing going for it.  at its worst, it implodes in a series of very bad special effects.  chokes on its own depiction of upper-crust decorum.  displaying about equal amounts of naiveté, passion and talent, beneath clouds establishes sen as a filmmaker of considerable potential. ","his last movie was poetically romantic and full of indelible images, but his latest has nothing going for it.  at its worst, it implodes in a series of very bad special effects.  chokes on its own depiction of upper-crust decorum.  displaying about equal amounts of naiveté, passion and talent, beneath clouds establishes sen as a filmmaker of considerable potential. ",15.951698303222656,1.0,1.0,1.0,1,1.0,1.0,82,82
ad07dc8ddbc6,hybrid_ce,gpt2,sst2,50,4,"this time mr. burns is trying something in the martin scorsese street-realist mode, but his self-regarding sentimentality trips him up again.  the sort of film that makes me miss hitchcock, but also feel optimistic that there's hope for popular cinema yet.  allows us to hope that nolan is poised to embark a major career as a commercial yet inventive filmmaker.  stealing harvard is evidence that the farrelly bros. -- peter and bobby -- and their brand of screen comedy are wheezing to an end, along with green's half-hearted movie career. ","this time mr. burns is trying something in the martin scorsese street-realist mode, but his self-regarding sentimentality trips him up again.  the sort of film that makes me miss hitchcock, but also feel optimistic that there's hope for popular cinema yet.  allows us to hope that nolan is poised to embark a major career as a commercial yet inventive filmmaker.  stealing harvard is evidence that the farrelly bros. -- peter and bobby -- and their brand of screen comedy are wheezing to an end, along with green's half-hearted movie career. ",11.124682188034058,1.0,1.0,1.0,1,1.0,1.0,128,128
ad07dc8ddbc6,hybrid_ce,gpt2,sst2,51,4,"a by-the-numbers patient/doctor pic that covers all the usual ground  if you've ever entertained the notion of doing what the title of this film implies, what sex with strangers actually shows may put you off the idea forever.  it's so good that its relentless, polished wit can withstand not only inept school productions, but even oliver parker's movie adaptation.  by getting myself wrapped up in the visuals and eccentricities of many of the characters, i found myself confused when it came time to get to the heart of the movie. ","a by-the-numbers patient/doctor pic that covers all the usual ground  if you've ever entertained the notion of doing what the title of this film implies, what sex with strangers actually shows may put you off the idea forever.  it's so good that its relentless, polished wit can withstand not only inept school productions, but even oliver parker's movie adaptation.  by getting myself wrapped up in the visuals and eccentricities of many of the characters, i found myself confused when it came time to get to the heart of the movie. ",11.10469675064087,1.0,1.0,1.0,1,1.0,1.0,114,114
ad07dc8ddbc6,hybrid_ce,gpt2,sst2,52,4,"harrison's flowers puts its heart in the right place, but its brains are in no particular place at all.  this surreal gilliam-esque film is also a troubling interpretation of ecclesiastes.  nothing in waking up in reno ever inspired me to think of its inhabitants as anything more than markers in a screenplay.  the story and the friendship proceeds in such a way that you're watching a soap opera rather than a chronicle of the ups and downs that accompany lifelong friendships. ","harrison's flowers puts its heart in the right place, but its brains are in no particular place at all.  this surreal gilliam-esque film is also a troubling interpretation of ecclesiastes.  nothing in waking up in reno ever inspired me to think of its inhabitants as anything more than markers in a screenplay.  the story and the friendship proceeds in such a way that you're watching a soap opera rather than a chronicle of the ups and downs that accompany lifelong friendships. ",10.850736618041992,1.0,1.0,1.0,1,1.0,1.0,102,102
ad07dc8ddbc6,hybrid_ce,gpt2,sst2,53,4,"the film will play equally well on both the standard and giant screens.  the movie's accumulated force still feels like an ugly knot tightening in your stomach.  few films capture so perfectly the hopes and dreams of little boys on baseball fields as well as the grown men who sit in the stands.  comes off like a rejected abc afterschool special, freshened up by the dunce of a screenwriting 101 class. ","the film will play equally well on both the standard and giant screens.  the movie's accumulated force still feels like an ugly knot tightening in your stomach.  few films capture so perfectly the hopes and dreams of little boys on baseball fields as well as the grown men who sit in the stands.  comes off like a rejected abc afterschool special, freshened up by the dunce of a screenwriting 101 class. ",10.78600263595581,1.0,1.0,1.0,1,1.0,1.0,87,87
