run_id,attack,model,dataset,input_index,num_sentences,joined_reference,joined_prediction,reconstruction_time_sec,rouge1_fm,rouge2_fm,rougeL_fm,exact_match,token_acc,padded_token_acc,pred_len,ref_len
ad07dc8ddbc6,hybrid_ce,gpt2,sst2,0,4,"it confirms fincher's status as a film maker who artfully bends technical know-how to the service of psychological insight.  too much of it feels unfocused and underdeveloped.  a great ensemble cast can't lift this heartfelt enterprise out of the familiar.  prurient playthings aside, there's little to love about this english trifle. ","it confirms fincher's status as a film maker who artfully bends technical know-how to the service of psychological insight.  too much of it feels unfocused and underdeveloped.  a great ensemble cast can't lift this heartfelt enterprise out of the familiar.  prurient playthings aside, there's little to love about this english trifle. ",11.821423530578613,1.0,1.0,1.0,1,1.0,1.0,72,72
ad07dc8ddbc6,hybrid_ce,gpt2,sst2,1,4,"it moves quickly, adroitly, and without fuss ; it doesn't give you time to reflect on the inanity -- and the cold war datedness -- of its premise.  it proves quite compelling as an intense, brooding character study.  bogdanovich tantalizes by offering a peep show into the lives of the era's creme de la celluloid.  looks and feels like a project better suited for the small screen. ","it moves quickly, adroitly, and without fuss ; it doesn't give you time to reflect on the inanity -- and the cold war datedness -- of its premise.  it proves quite compelling as an intense, brooding character study.  bogdanovich tantalizes by offering a peep show into the lives of the era's creme de la celluloid.  looks and feels like a project better suited for the small screen. ",11.027185678482056,1.0,1.0,1.0,1,1.0,1.0,91,91
ad07dc8ddbc6,hybrid_ce,gpt2,sst2,2,4,"verbinski implements every hack-artist trick to give us the ooky-spookies.  this is a good script, good dialogue, funny even for adults.  a painfully funny ode to bad behavior.  there is a fabric of complex ideas here, and feelings that profoundly deepen them. ","verbinski implements every hack-artist trick to give us the ooky-spookies.  this is a good script, good dialogue, funny even for adults.  a painfully funny ode to bad behavior.  there is a fabric of complex ideas here, and feelings that profoundly deepen them. ",10.653866052627563,1.0,1.0,1.0,1,1.0,1.0,62,62
ad07dc8ddbc6,hybrid_ce,gpt2,sst2,3,4,"the overall effect is less like a children's movie than a recruitment film for future hollywood sellouts.  as the two leads, lathan and diggs are charming and have chemistry both as friends and lovers.  the title not only describes its main characters, but the lazy people behind the camera as well.  zhang... has done an amazing job of getting realistic performances from his mainly nonprofessional cast. ","the overall effect is less like a children's movie than a recruitment film for future hollywood sellouts.  as the two leads, lathan and diggs are charming and have chemistry both as friends and lovers.  the title not only describes its main characters, but the lazy people behind the camera as well.  zhang... has done an amazing job of getting realistic performances from his mainly nonprofessional cast. ",10.578695297241211,1.0,1.0,1.0,1,1.0,1.0,84,84
ad07dc8ddbc6,hybrid_ce,gpt2,sst2,4,4,"not only is undercover brother as funny, if not more so, than both austin powers films, but it's also one of the smarter, savvier spoofs to come along in some time.  beautifully observed, miraculously unsentimental comedy-drama.  the last 20 minutes are somewhat redeeming, but most of the movie is the same teenage american road-trip drek we've seen before - only this time you have to read the fart jokes  if you dig on david mamet's mind tricks... rent this movie and enjoy! ","not only is undercover brother as funny, if not more so, than both austin powers films, but it's also one of the smarter, savvier spoofs to come along in some time.  beautifully observed, miraculously unsentimental comedy-drama.  the last 20 minutes are somewhat redeeming, but most of the movie is the same teenage american road-trip drek we've seen before - only this time you have to read the fart jokes  if you dig on david mamet's mind tricks... rent this movie and enjoy! ",10.963455438613892,1.0,1.0,1.0,1,1.0,1.0,115,115
ad07dc8ddbc6,hybrid_ce,gpt2,sst2,5,4,"for all its impressive craftsmanship, and despite an overbearing series of third-act crescendos, lily chou-chou never really builds up a head of emotional steam.  yes, dull.  shaky close-ups of turkey-on-rolls, stubbly chins, liver spots, red noses and the filmmakers new bobbed do draw easy chuckles but lead nowhere.  the second coming of harry potter is a film far superior to its predecessor. ","for all its impressive craftsmanship, and despite an overbearing series of third-act crescendos, lily chou-chou never really builds up a head of emotional steam.  yes, dull.  shaky close-ups of turkey-on-rolls, stubbly chins, liver spots, red noses and the filmmakers new bobbed do draw easy chuckles but lead nowhere.  the second coming of harry potter is a film far superior to its predecessor. ",10.961345911026001,1.0,1.0,1.0,1,1.0,1.0,101,101
ad07dc8ddbc6,hybrid_ce,gpt2,sst2,6,4,"if you're hard up for raunchy college humor, this is your ticket right here.  nonsensical, dull `` cyber-horror '' flick is a grim, hollow exercise in flat scares and bad acting.  a delectable and intriguing thriller filled with surprises, read my lips is an original.  thanks to scott's charismatic roger and eisenberg's sweet nephew, roger dodger is one of the most compelling variations on in the company of men. ","if you're hard up for raunchy college humor, this is your ticket right here.  nonsensical, dull `` cyber-horror '' flick is a grim, hollow exercise in flat scares and bad acting.  a delectable and intriguing thriller filled with surprises, read my lips is an original.  thanks to scott's charismatic roger and eisenberg's sweet nephew, roger dodger is one of the most compelling variations on in the company of men. ",10.82051968574524,1.0,1.0,1.0,1,1.0,1.0,98,98
ad07dc8ddbc6,hybrid_ce,gpt2,sst2,7,4,"there's no emotional pulse to solaris.  a fast, funny, highly enjoyable movie.  too restrained to be a freak show, too mercenary and obvious to be cerebral, too dull and pretentious to be engaging... the isle defies an easy categorization.  an unwise amalgam of broadcast news and vibes. ","there's no emotional pulse to solaris.  a fast, funny, highly enjoyable movie.  too restrained to be a freak show, too mercenary and obvious to be cerebral, too dull and pretentious to be engaging... the isle defies an easy categorization.  an unwise amalgam of broadcast news and vibes. ",10.83345890045166,1.0,1.0,1.0,1,1.0,1.0,69,69
ad07dc8ddbc6,hybrid_ce,gpt2,sst2,8,4,"a pleasant enough romance with intellectual underpinnings, the kind of movie that entertains even as it turns maddeningly predictable.  it's not original, and, robbed of the element of surprise, it doesn't have any huge laughs in its story of irresponsible cops who love to play pranks.  it's hard to imagine alan arkin being better than he is in this performance.  dazzles with its fully-written characters, its determined stylishness ( which always relates to characters and story ) and johnny dankworth's best soundtrack in years. ","a pleasant enough romance with intellectual underpinnings, the kind of movie that entertains even as it turns maddeningly predictable.  it's not original, and, robbed of the element of surprise, it doesn't have any huge laughs in its story of irresponsible cops who love to play pranks.  it's hard to imagine alan arkin being better than he is in this performance.  dazzles with its fully-written characters, its determined stylishness ( which always relates to characters and story ) and johnny dankworth's best soundtrack in years. ",10.805548429489136,1.0,1.0,1.0,1,1.0,1.0,118,118
ad07dc8ddbc6,hybrid_ce,gpt2,sst2,9,4,"fun, flip and terribly hip bit of cinematic entertainment.  the movie fails to live up to the sum of its parts.  one of the more intelligent children's movies to hit theaters this year.  corpus collosum -- while undeniably interesting -- wore out its welcome well before the end credits rolled about 45 minutes in. ","fun, flip and terribly hip bit of cinematic entertainment.  the movie fails to live up to the sum of its parts.  one of the more intelligent children's movies to hit theaters this year.  corpus collosum -- while undeniably interesting -- wore out its welcome well before the end credits rolled about 45 minutes in. ",10.741620063781738,1.0,1.0,1.0,1,1.0,1.0,66,66
ad07dc8ddbc6,hybrid_ce,gpt2,sst2,10,4,"the performances take the movie to a higher level.  one of those pictures whose promising, if rather precious, premise is undercut by amateurish execution.  a compelling spanish film about the withering effects of jealousy in the life of a young monarch whose sexual passion for her husband becomes an obsession.  uses high comedy to evoke surprising poignance. ","the performances take the movie to a higher level.  one of those pictures whose promising, if rather precious, premise is undercut by amateurish execution.  a compelling spanish film about the withering effects of jealousy in the life of a young monarch whose sexual passion for her husband becomes an obsession.  uses high comedy to evoke surprising poignance. ",10.64339804649353,1.0,1.0,1.0,1,1.0,1.0,72,72
ad07dc8ddbc6,hybrid_ce,gpt2,sst2,11,4,"it has all the excitement of eating oatmeal.  feature debuter d.j. caruso directs a crack ensemble cast, bringing screenwriter tony gayton's narcotics noir to life.  the old-world - meets-new mesh is incarnated in the movie's soundtrack, a joyful effusion of disco bollywood that, by the end of monsoon wedding, sent my spirit soaring out of the theater.  an important movie, a reminder of the power of film to move us and to make us examine our values. ","it has all the excitement of eating oatmeal.  feature debuter d.j. caruso directs a crack ensemble cast, bringing screenwriter tony gayton's narcotics noir to life.  the old-world - meets-new mesh is incarnated in the movie's soundtrack, a joyful effusion of disco bollywood that, by the end of monsoon wedding, sent my spirit soaring out of the theater.  an important movie, a reminder of the power of film to move us and to make us examine our values. ",11.03007459640503,1.0,1.0,1.0,1,1.0,1.0,111,111
ad07dc8ddbc6,hybrid_ce,gpt2,sst2,12,4,"it's a bit disappointing that it only manages to be decent instead of dead brilliant.  it's not the ultimate depression-era gangster movie.  it has the charm of the original american road movies, feasting on the gorgeous, ramshackle landscape of the filmmaker's motherland.  the vitality of the actors keeps the intensity of the film high, even as the strafings blend together. ","it's a bit disappointing that it only manages to be decent instead of dead brilliant.  it's not the ultimate depression-era gangster movie.  it has the charm of the original american road movies, feasting on the gorgeous, ramshackle landscape of the filmmaker's motherland.  the vitality of the actors keeps the intensity of the film high, even as the strafings blend together. ",10.873271942138672,1.0,1.0,1.0,1,1.0,1.0,84,84
ad07dc8ddbc6,hybrid_ce,gpt2,sst2,13,4,"the movie isn't just hilarious : it's witty and inventive, too, and in hindsight, it isn't even all that dumb.  it's difficult to imagine the process that produced such a script, but here's guessing that spray cheese and underarm noises played a crucial role.  while locals will get a kick out of spotting cleveland sites, the rest of the world will enjoy a fast-paced comedy with quirks that might make the award-winning coen brothers envious.  broomfield turns his distinctive ` blundering'style into something that could really help clear up the case. ","the movie isn't just hilarious : it's witty and inventive, too, and in hindsight, it isn't even all that dumb.  it's difficult to imagine the process that produced such a script, but here's guessing that spray cheese and underarm noises played a crucial role.  while locals will get a kick out of spotting cleveland sites, the rest of the world will enjoy a fast-paced comedy with quirks that might make the award-winning coen brothers envious.  broomfield turns his distinctive ` blundering'style into something that could really help clear up the case. ",11.196492671966553,1.0,1.0,1.0,1,1.0,1.0,123,123
ad07dc8ddbc6,hybrid_ce,gpt2,sst2,14,4,"oh come on.  awesome creatures, breathtaking scenery, and epic battle scenes add up to another ` spectacular spectacle.' paid in full is so stale, in fact, that its most vibrant scene is one that uses clips from brian de palma's scarface.  warm water under a red bridge is a quirky and poignant japanese film that explores the fascinating connections between women, water, nature, and sexuality. ","oh come on.  awesome creatures, breathtaking scenery, and epic battle scenes add up to another ` spectacular spectacle.' paid in full is so stale, in fact, that its most vibrant scene is one that uses clips from brian de palma's scarface.  warm water under a red bridge is a quirky and poignant japanese film that explores the fascinating connections between women, water, nature, and sexuality. ",10.855282068252563,1.0,1.0,1.0,1,1.0,1.0,85,85
ad07dc8ddbc6,hybrid_ce,gpt2,sst2,15,4,"the wild thornberrys movie is a jolly surprise.  the film flat lines when it should peak and is more missed opportunity and trifle than dark, decadent truffle.  for the first time in years, de niro digs deep emotionally, perhaps because he's been stirred by the powerful work of his co-stars.  escaping the studio, piccoli is warmly affecting and so is this adroitly minimalist movie. ","the wild thornberrys movie is a jolly surprise.  the film flat lines when it should peak and is more missed opportunity and trifle than dark, decadent truffle.  for the first time in years, de niro digs deep emotionally, perhaps because he's been stirred by the powerful work of his co-stars.  escaping the studio, piccoli is warmly affecting and so is this adroitly minimalist movie. ",10.79900050163269,1.0,1.0,1.0,1,1.0,1.0,91,91
ad07dc8ddbc6,hybrid_ce,gpt2,sst2,16,4,"a moody, multi-dimensional love story and sci-fi mystery, solaris is a thought-provoking, haunting film that allows the seeds of the imagination to germinate.  a celebration of quirkiness, eccentricity, and certain individuals'tendency to let it all hang out, and damn the consequences.  harris commands the screen, using his frailty to suggest the ravages of a life of corruption and ruthlessness.  it does nothing new with the old story, except to show fisticuffs in this sort of stop-go slow motion that makes the gang rumbles look like they're being streamed over a 28k modem. ","a moody, multi-dimensional love story and sci-fi mystery, solaris is a thought-provoking, haunting film that allows the seeds of the imagination to germinate.  a celebration of quirkiness, eccentricity, and certain individuals'tendency to let it all hang out, and damn the consequences.  harris commands the screen, using his frailty to suggest the ravages of a life of corruption and ruthlessness.  it does nothing new with the old story, except to show fisticuffs in this sort of stop-go slow motion that makes the gang rumbles look like they're being streamed over a 28k modem. ",11.391554832458496,1.0,1.0,1.0,1,1.0,1.0,136,136
ad07dc8ddbc6,hybrid_ce,gpt2,sst2,17,4,"martin and barbara are complex characters -- sometimes tender, sometimes angry -- and the delicate performances by sven wollter and viveka seldahl make their hopes and frustrations vivid.  as a first-time director, paxton has tapped something in himself as an actor that provides frailty with its dark soul.  the result is a gaudy bag of stale candy, something from a halloween that died.  it is great summer fun to watch arnold and his buddy gerald bounce off a quirky cast of characters. ","martin and barbara are complex characters -- sometimes tender, sometimes angry -- and the delicate performances by sven wollter and viveka seldahl make their hopes and frustrations vivid.  as a first-time director, paxton has tapped something in himself as an actor that provides frailty with its dark soul.  the result is a gaudy bag of stale candy, something from a halloween that died.  it is great summer fun to watch arnold and his buddy gerald bounce off a quirky cast of characters. ",11.027073383331299,1.0,1.0,1.0,1,1.0,1.0,113,113
ad07dc8ddbc6,hybrid_ce,gpt2,sst2,18,4,"the best revenge may just be living well because this film, unlike other dumas adaptations, is far more likened to a treasure than a lengthy jail sentence.  sticky sweet sentimentality, clumsy plotting and a rosily myopic view of life in the wwii-era mississippi delta undermine this adaptation.  even if you don't think ( kissinger's ) any more guilty of criminal activity than most contemporary statesmen, he 'd sure make a courtroom trial great fun to watch.  forced, familiar and thoroughly condescending. ","the best revenge may just be living well because this film, unlike other dumas adaptations, is far more likened to a treasure than a lengthy jail sentence.  sticky sweet sentimentality, clumsy plotting and a rosily myopic view of life in the wwii-era mississippi delta undermine this adaptation.  even if you don't think ( kissinger's ) any more guilty of criminal activity than most contemporary statesmen, he 'd sure make a courtroom trial great fun to watch.  forced, familiar and thoroughly condescending. ",10.8916175365448,1.0,1.0,1.0,1,1.0,1.0,112,112
ad07dc8ddbc6,hybrid_ce,gpt2,sst2,19,4,"this is a winning ensemble comedy that shows canadians can put gentle laughs and equally gentle sentiments on the button, just as easily as their counterparts anywhere else in the world.  scores no points for originality, wit, or intelligence.  an entertaining, colorful, action-filled crime story with an intimate heart.  manages to be sweet and wickedly satisfying at the same time. ","this is a winning ensemble comedy that shows canadians can put gentle laughs and equally gentle sentiments on the button, just as easily as their counterparts anywhere else in the world.  scores no points for originality, wit, or intelligence.  an entertaining, colorful, action-filled crime story with an intimate heart.  manages to be sweet and wickedly satisfying at the same time. ",10.85667896270752,1.0,1.0,1.0,1,1.0,1.0,79,79
ad07dc8ddbc6,hybrid_ce,gpt2,sst2,20,4,"i got a headache watching this meaningless downer.  it's a stunning lyrical work of considerable force and truth.  i've always dreamed of attending cannes, but after seeing this film, it's not that big a deal.  so much facile technique, such cute ideas, so little movie. ","i got a headache watching this meaningless downer.  it's a stunning lyrical work of considerable force and truth.  i've always dreamed of attending cannes, but after seeing this film, it's not that big a deal.  so much facile technique, such cute ideas, so little movie. ",10.728153467178345,1.0,1.0,1.0,1,1.0,1.0,64,64
ad07dc8ddbc6,hybrid_ce,gpt2,sst2,21,4,"the movie is dawn of the dead crossed with john carpenter's ghosts of mars, with zombies not as ghoulish as the first and trains not as big as the second.  just not campy enough  when leguizamo finally plugged an irritating character late in the movie.  visually imaginative, thematically instructive and thoroughly delightful, it takes us on a roller-coaster ride from innocence to experience without even a hint of that typical kiddie-flick sentimentality. ","the movie is dawn of the dead crossed with john carpenter's ghosts of mars, with zombies not as ghoulish as the first and trains not as big as the second.  just not campy enough  when leguizamo finally plugged an irritating character late in the movie.  visually imaginative, thematically instructive and thoroughly delightful, it takes us on a roller-coaster ride from innocence to experience without even a hint of that typical kiddie-flick sentimentality. ",11.035027503967285,1.0,1.0,1.0,1,1.0,1.0,101,101
ad07dc8ddbc6,hybrid_ce,gpt2,sst2,22,4,"( e ) ventually, every idea in this film is flushed down the latrine of heroism.  the story and structure are well-honed.  for close to two hours the audience is forced to endure three terminally depressed, mostly inarticulate, hyper dysfunctional families for the price of one.  a rarity among recent iranian films : it's a comedy full of gentle humor that chides the absurdity of its protagonist's plight. ","( e ) ventually, every idea in this film is flushed down the latrine of heroism.  the story and structure are well-honed.  for close to two hours the audience is forced to endure three terminally depressed, mostly inarticulate, hyper dysfunctional families for the price of one.  a rarity among recent iranian films : it's a comedy full of gentle humor that chides the absurdity of its protagonist's plight. ",10.854578018188477,1.0,1.0,1.0,1,1.0,1.0,92,92
ad07dc8ddbc6,hybrid_ce,gpt2,sst2,23,4,"/ but daphne, you're too buff / fred thinks he's tough / and velma - wow, you've lost weight!  `` mostly martha '' is a bright, light modern day family parable that wears its heart on its sleeve for all to see.  a bloated gasbag thesis grotesquely impressed by its own gargantuan aura of self-importance...  too slow, too long and too little happens. ","/ but daphne, you're too buff / fred thinks he's tough / and velma - wow, you've lost weight!  `` mostly martha '' is a bright, light modern day family parable that wears its heart on its sleeve for all to see.  a bloated gasbag thesis grotesquely impressed by its own gargantuan aura of self-importance...  too slow, too long and too little happens. ",10.828493595123291,1.0,1.0,1.0,1,1.0,1.0,91,91
ad07dc8ddbc6,hybrid_ce,gpt2,sst2,24,4,"not only are the special effects and narrative flow much improved, and daniel radcliffe more emotionally assertive this time around as harry, but the film conjures the magic of author j.k. rowling's books.  has all the depth of a wading pool.  even in its most tedious scenes, russian ark is mesmerizing.  on this tricky topic, tadpole is very much a step in the right direction, with its blend of frankness, civility and compassion. ","not only are the special effects and narrative flow much improved, and daniel radcliffe more emotionally assertive this time around as harry, but the film conjures the magic of author j.k. rowling's books.  has all the depth of a wading pool.  even in its most tedious scenes, russian ark is mesmerizing.  on this tricky topic, tadpole is very much a step in the right direction, with its blend of frankness, civility and compassion. ",11.071604013442993,1.0,1.0,1.0,1,1.0,1.0,104,104
ad07dc8ddbc6,hybrid_ce,gpt2,sst2,25,4,"candid and comfortable ; a film that deftly balances action and reflection as it lets you grasp and feel the passion others have for their work.  this is human comedy at its most amusing, interesting and confirming.  in an effort, i suspect, not to offend by appearing either too serious or too lighthearted, it offends by just being wishy-washy.  you wonder why enough wasn't just a music video rather than a full-length movie. ","candid and comfortable ; a film that deftly balances action and reflection as it lets you grasp and feel the passion others have for their work.  this is human comedy at its most amusing, interesting and confirming.  in an effort, i suspect, not to offend by appearing either too serious or too lighthearted, it offends by just being wishy-washy.  you wonder why enough wasn't just a music video rather than a full-length movie. ",10.862902879714966,1.0,1.0,1.0,1,1.0,1.0,96,96
ad07dc8ddbc6,hybrid_ce,gpt2,sst2,26,4,"this is not the undisputed worst boxing movie ever, but it's certainly not a champion - the big loser is the audience.  ... a fun little timewaster, helped especially by the cool presence of jean reno.  mcconaughey's fun to watch, the dragons are okay, not much fire in the script.  there is nothing outstanding about this film, but it is good enough and will likely be appreciated most by sailors and folks who know their way around a submarine. ","this is not the undisputed worst boxing movie ever, but it's certainly not a champion - the big loser is the audience.  ... a fun little timewaster, helped especially by the cool presence of jean reno.  mcconaughey's fun to watch, the dragons are okay, not much fire in the script.  there is nothing outstanding about this film, but it is good enough and will likely be appreciated most by sailors and folks who know their way around a submarine. ",10.865514755249023,1.0,1.0,1.0,1,1.0,1.0,103,103
ad07dc8ddbc6,hybrid_ce,gpt2,sst2,27,4,"care deftly captures the wonder and menace of growing up, but he never really embraces the joy of fuhrman's destructive escapism or the grace-in-rebellion found by his characters.  less dizzying than just dizzy, the jaunt is practically over before it begins.  a coarse and stupid gross-out.  serving sara doesn't serve up a whole lot of laughs. ","care deftly captures the wonder and menace of growing up, but he never really embraces the joy of fuhrman's destructive escapism or the grace-in-rebellion found by his characters.  less dizzying than just dizzy, the jaunt is practically over before it begins.  a coarse and stupid gross-out.  serving sara doesn't serve up a whole lot of laughs. ",10.9145987033844,1.0,1.0,1.0,1,1.0,1.0,86,86
